Année 2016 - services de police,Départements,01,01,01,01,02,02,02,02,02,03,03,03,04,04,05,05,05,05,06,06,06,06,06,06,06,06,06,06,06,07,07,07,08,08,09,09,10,11,11,11,11,12,12,12,13,13,13,13,13,13,13,13,13,13,13,13,13,13,13,13,13,13,13,13,13,13,13,13,14,14,14,14,14,14,15,16,16,17,17,17,17,18,18,19,19,19,21,21,21,21,22,22,23,24,24,24,25,25,25,25,25,25,26,26,26,26,27,27,27,28,28,29,29,29,29,2A,2A,2A,2A,2A,2B,2B,2B,2B,2B,30,30,30,30,30,30,30,31,31,31,31,31,31,31,32,33,33,33,33,33,33,34,34,34,34,34,34,34,34,35,35,35,35,35,35,35,35,35,36,37,37,38,38,38,38,38,38,38,39,39,40,40,41,41,42,42,42,42,42,42,43,44,44,44,44,44,44,45,45,45,45,46,47,47,48,49,49,49,49,50,50,50,50,50,50,51,51,51,51,52,52,53,54,54,54,54,54,54,54,54,54,54,54,54,54,55,55,56,56,57,57,57,57,57,57,57,57,57,57,57,57,57,58,59,59,59,59,59,59,59,59,59,59,59,59,59,59,59,59,59,59,59,59,60,60,60,60,60,60,61,61,61,62,62,62,62,62,62,62,62,62,62,62,62,62,62,62,62,62,62,62,63,63,63,63,63,63,63,63,64,64,64,64,64,64,64,64,64,64,64,65,65,66,66,66,66,66,66,66,66,67,67,67,67,67,67,67,67,67,68,68,68,68,68,68,68,69,69,69,69,69,69,69,69,69,69,69,69,69,69,69,69,70,70,71,71,71,71,72,73,73,73,73,73,73,74,74,74,74,74,74,74,75,75,75,75,75,75,75,75,75,75,75,75,75,75,75,75,75,75,75,75,75,75,75,75,75,75,75,75,75,75,75,75,75,75,75,75,75,75,75,75,75,75,75,75,75,75,75,75,75,76,76,76,76,76,76,76,76,76,76,76,77,77,77,77,77,77,77,77,77,77,77,77,77,77,77,77,77,77,77,78,78,78,78,78,78,78,78,78,78,78,78,78,78,78,78,78,78,78,78,78,78,79,79,80,80,80,81,81,81,81,82,82,83,83,83,83,83,83,83,83,83,83,84,84,84,84,84,84,85,85,86,86,86,87,87,87,88,88,88,89,89,90,91,91,91,91,91,91,91,91,91,91,91,91,91,91,91,91,91,92,92,92,92,92,92,92,92,92,92,92,92,92,92,92,92,92,92,92,92,92,92,92,92,92,92,92,92,92,92,92,92,92,92,92,92,92,92,92,92,92,92,93,93,93,93,93,93,93,93,93,93,93,93,93,93,93,93,93,93,93,93,93,93,93,93,93,93,93,93,94,94,94,94,94,94,94,94,94,94,94,94,94,94,94,94,94,94,94,94,94,94,95,95,95,95,95,95,95,95,95,95,95,95,95,95,95,95,971,971,971,971,971,971,971,971,971,971,971,972,972,972,972,972,973,973,973,973,973,974,974,974,974,974,974,974,976,976,976,987,987,987,988,988,988
,Périmètres,DCPAF,DCPAF,DCSP,DCSP,DCSP,DCSP,DCSP,DCSP,DCSP,DCSP,DCSP,DCSP,DCSP,DCSP,DCPAF,DCPAF,DCSP,DCSP,DCPAF,DCPAF,DCPAF,DCPAF,DCPJ,DCSP,DCSP,DCSP,DCSP,DCSP,DCSP,DCSP,DCSP,DCSP,DCSP,DCSP,DCSP,DCSP,DCSP,DCPAF,DCPAF,DCSP,DCSP,DCSP,DCSP,DCSP,DCCRS,DCPAF,DCPAF,DCPAF,DCPAF,DCPAF,DCPAF,DCPAF,DCPJ,DCPJ,DCSP,DCSP,DCSP,DCSP,DCSP,DCSP,DCSP,DCSP,DCSP,DCSP,DCSP,DCSP,DCSP,DCSP,DCPAF,DCSP,DCSP,DCSP,DCSP,DCSP,DCSP,DCSP,DCSP,DCSP,DCSP,DCSP,DCSP,DCSP,DCSP,DCSP,DCSP,DCSP,DCPAF,DCPJ,DCSP,DCSP,DCSP,DCSP,DCSP,DCPJ,DCSP,DCSP,DCPAF,DCPAF,DCPAF,DCSP,DCSP,DCSP,DCPJ,DCSP,DCSP,DCSP,DCSP,DCSP,DCSP,DCSP,DCSP,DCSP,DCSP,DCSP,DCSP,DCPAF,DCPAF,DCPAF,DCPJ,DCSP,DCPAF,DCPAF,DCPAF,DCPAF,DCSP,DCPAF,DCPAF,DCPAF,DCPJ,DCSP,DCSP,DCSP,DCPAF,DCPAF,DCPAF,DCPAF,DCPJ,DCSP,DCSP,DCSP,DCCRS,DCPAF,DCPAF,DCPJ,DCSP,DCSP,DCPAF,DCPAF,DCPAF,DCPJ,DCSP,DCSP,DCSP,DCSP,DCPAF,DCPAF,DCPAF,DCPAF,DCPAF,DCPJ,DCSP,DCSP,DCSP,DCSP,DCPJ,DCSP,DCCRS,DCPAF,DCPJ,DCSP,DCSP,DCSP,DCSP,DCSP,DCSP,DCSP,DCSP,DCSP,DCSP,DCCRS,DCPJ,DCSP,DCSP,DCSP,DCSP,DCSP,DCPAF,DCPAF,DCPAF,DCSP,DCSP,DCSP,DCPAF,DCPJ,DCSP,DCSP,DCSP,DCSP,DCSP,DCSP,DCPJ,DCSP,DCSP,DCSP,DCPAF,DCPAF,DCSP,DCSP,DCSP,DCSP,DCPJ,DCSP,DCSP,DCSP,DCSP,DCSP,DCSP,DCCRS,DCPAF,DCPAF,DCPJ,DCSP,DCSP,DCSP,DCSP,DCSP,DCSP,DCSP,DCSP,DCSP,DCSP,DCSP,DCSP,DCSP,DCCRS,DCPAF,DCPAF,DCPAF,DCPAF,DCPAF,DCSP,DCSP,DCSP,DCSP,DCSP,DCSP,DCSP,DCSP,DCCRS,DCCRS,DCPAF,DCPAF,DCPAF,DCPAF,DCPAF,DCPAF,DCPJ,DCSP,DCSP,DCSP,DCSP,DCSP,DCSP,DCSP,DCSP,DCSP,DCSP,DCSP,DCPAF,DCPAF,DCPJ,DCSP,DCSP,DCSP,DCSP,DCSP,DCSP,DCPAF,DCPAF,DCPAF,DCPAF,DCPAF,DCPJ,DCSP,DCSP,DCSP,DCSP,DCSP,DCSP,DCSP,DCSP,DCSP,DCSP,DCSP,DCSP,DCSP,DCPAF,DCPAF,DCPAF,DCPJ,DCSP,DCSP,DCSP,DCSP,DCPAF,DCPAF,DCPAF,DCPAF,DCPAF,DCPJ,DCPJ,DCSP,DCSP,DCSP,DCSP,DCSP,DCSP,DCPAF,DCPAF,DCPAF,DCPAF,DCPAF,DCPAF,DCPJ,DCSP,DCCRS,DCPAF,DCPAF,DCPAF,DCPAF,DCPJ,DCSP,DCSP,DCSP,DCPAF,DCPAF,DCPAF,DCSP,DCSP,DCSP,DCSP,DCCRS,DCPAF,DCPAF,DCPAF,DCPAF,DCPAF,DCPJ,DCPJ,DCPJ,DCSP,DCSP,DCSP,DCSP,DCSP,DCSP,DCSP,DCSP,DCSP,DCSP,DCSP,DCSP,DCSP,DCSP,DCPAF,DCPAF,DCPAF,DCSP,DCSP,DCSP,DCPAF,DCPAF,DCPAF,DCPJ,DCSP,DCSP,DCSP,DCPAF,DIRECTION ORDRE PUBLIC ET CIRCULATION,DIRECTION ORDRE PUBLIC ET CIRCULATION,DIRECTION ORDRE PUBLIC ET CIRCULATION,DIRECTION ORDRE PUBLIC ET CIRCULATION,DIRECTION ORDRE PUBLIC ET CIRCULATION,DIRECTION REGIONALE PJ PARIS,DIRECTION REGIONALE PJ PARIS,DIRECTION REGIONALE PJ PARIS,DIRECTION REGIONALE PJ PARIS,DIRECTION REGIONALE PJ PARIS,DIRECTION REGIONALE PJ PARIS,DIRECTION REGIONALE PJ PARIS,DIRECTION REGIONALE PJ PARIS,DIRECTION REGIONALE PJ PARIS,DIRECTION REGIONALE PJ PARIS,DIRECTION REGIONALE PJ PARIS,DIRECTION REGIONALE PJ PARIS,DIRECTION REGIONALE PJ PARIS,DIRECTION REGIONALE PJ PARIS,DIRECTION REGIONALE PJ PARIS,DIRECTION REGIONALE PJ PARIS,DIRECTION SERVICES TECHN ET LOGISTIQUES,DSPAP,DSPAP,DSPAP,DSPAP,DSPAP,DSPAP,DSPAP,DSPAP,DSPAP,DSPAP,DSPAP,DSPAP,DSPAP,DSPAP,DSPAP,DSPAP,DSPAP,DSPAP,DSPAP,DSPAP,DSPAP,DSPAP,DSPAP,DSPAP,DSPAP,DSPAP,DCPAF,DCPAF,DCPAF,DCPAF,DCPJ,DCPJ,DCSP,DCSP,DCSP,DCSP,DCSP,DCCRS,DCPAF,DCPAF,DCSP,DCSP,DCSP,DCSP,DCSP,DCSP,DCSP,DCSP,DCSP,DCSP,DCSP,DCSP,DCSP,DCSP,DCSP,DCSP,DCPAF,DCPAF,DCPJ,DCSP,DCSP,DCSP,DCSP,DCSP,DCSP,DCSP,DCSP,DCSP,DCSP,DCSP,DCSP,DCSP,DCSP,DCSP,DCSP,DCSP,DCSP,DCSP,DCSP,DCSP,DCPJ,DCSP,DCSP,DCSP,DCSP,DCSP,DCSP,DCSP,DCSP,DCCRS,DCPAF,DCPAF,DCPJ,DCSP,DCSP,DCSP,DCSP,DCSP,DCSP,DCPAF,DCPJ,DCSP,DCSP,DCSP,DCSP,DCSP,DCSP,DCPJ,DCSP,DCSP,DCPAF,DCPJ,DCSP,DCSP,DCSP,DCSP,DCSP,DCSP,DCSP,DCCRS,DCPAF,DCSP,DCSP,DCSP,DCSP,DCSP,DCSP,DCSP,DCSP,DCSP,DCSP,DCSP,DCSP,DCSP,DCSP,DCSP,DCCRS,DCPJ,DCPJ,DCPJ,DCPJ,DCPJ,DCPJ,DCPJ,DCPJ,DCPJ,DCPJ,DCPJ,DCPJ,DIRECTION ORDRE PUBLIC ET CIRCULATION,DIRECTION REGIONALE PJ PARIS,DIRECTION REGIONALE PJ PARIS,DSPAP,DSPAP,DSPAP,DSPAP,DSPAP,DSPAP,DSPAP,DSPAP,DSPAP,DSPAP,DSPAP,DSPAP,DSPAP,DSPAP,DSPAP,DSPAP,DSPAP,DSPAP,DSPAP,DSPAP,DSPAP,DSPAP,DSPAP,DSPAP,DSPAP,DSPAP,DCPAF,DIRECTION ORDRE PUBLIC ET CIRCULATION,DIRECTION REGIONALE PJ PARIS,DIRECTION REGIONALE PJ PARIS,DSPAP,DSPAP,DSPAP,DSPAP,DSPAP,DSPAP,DSPAP,DSPAP,DSPAP,DSPAP,DSPAP,DSPAP,DSPAP,DSPAP,DSPAP,DSPAP,DSPAP,DSPAP,DSPAP,DSPAP,DSPAP,DSPAP,DSPAP,DSPAP,DCPAF,DIRECTION ORDRE PUBLIC ET CIRCULATION,DIRECTION REGIONALE PJ PARIS,DIRECTION REGIONALE PJ PARIS,DSPAP,DSPAP,DSPAP,DSPAP,DSPAP,DSPAP,DSPAP,DSPAP,DSPAP,DSPAP,DSPAP,DSPAP,DSPAP,DSPAP,DSPAP,DSPAP,DSPAP,DSPAP,DCCRS,DCPAF,DCPAF,DCPAF,DCSP,DCSP,DCSP,DCSP,DCSP,DCSP,DCSP,DCSP,DCSP,DCSP,DCSP,DCSP,DCPAF,DCPAF,DCPAF,DCPAF,DCPAF,DCPAF,DCPJ,DCPJ,DCSP,DCSP,DCSP,DCPAF,DCPAF,DCPJ,DCSP,DCSP,DCPAF,DCPAF,DCPAF,DCPAF,DCSP,DCPAF,DCPAF,DCPAF,DCSP,DCSP,DCSP,DCSP,DCPAF,DCPAF,DCSP,DCPAF,DCPAF,DCSP,DCPAF,DCPAF,DCSP
Code index,Libellé index \ CSP,BMRA 01,SPAFT PREVESSIN,CIAT DE BOURG EN BRESSE,CIAT D'OYONNAX,CIAT DE CHATEAU THIERRY,CIAT DE LAON,CIAT DE SOISSONS,CIAT DE ST QUENTIN,CIAT DE TERGNIER LA FERE,CIAT DE MONTLUCON,CIAT DE MOULINS,CIAT DE VICHY,CIAT DE DIGNE,CIAT DE MANOSQUE,BMRA 05,SPAFT MONTGENEVRE,CIAT DE BRIANCON,CIAT DE GAP,BCFA NICE,BMRA 06,SPAFA NICE COTE D'AZUR,SPAFT MENTON,ANTENNE PJ DE NICE,CIAT CENTRAL DE NICE,CIAT D'ANTIBES,CIAT DE CAGNES SUR MER,CIAT DE CANNES,CIAT DE GRASSE,CIAT DE MENTON,CIAT D'AUBENAS,CIAT DE GUILHERAND GRANGES,CIAT DE PRIVAS,CIAT DE CHARLEVILLE MEZIERES,CIAT DE SEDAN,CIAT DE FOIX,CIAT DE PAMIERS,CIAT CENTRAL DE TROYES,BMRA 11,SPAFT PORT LA NOUVELLE,CIAT DE CARCASSONNE,CIAT DE NARBONNE,CIAT DE DECAZEVILLE,CIAT DE MILLAU,CIAT DE RODEZ,CRS AUTO PROVENCE MARSEILLE,BCFZ SUD,BMRZ SUD,CRA MARSEILLE CANET,SPAFA MARSEILLE PROVENCE,SPAFP MARSEILLE,UJI MARSEILLE,USG 13,GIR PROVENCE ALPES COTE D'AZUR,SRPJ DE MARSEILLE,CIAT D'AIX EN PROVENCE,CIAT D'ARLES,CIAT D'AUBAGNE,CIAT DE LA CIOTAT,CIAT DE MARIGNANE,CIAT DE MARTIGUES,CIAT DE SALON DE PROVENCE,CIAT DE VITROLLES,CIAT D'ISTRES,CISP DE TARASCON BEAUCAIRE,DSP MARSEILLE CENTRE,DSP MARSEILLE NORD,DSP MARSEILLE SUD,SURETE DEPARTEMENTALE DES BOUCHES DU RHO,BMRA 14,CIAT CENTRAL DE CAEN,CIAT DE DEAUVILLE,CIAT DE DIVES SUR MER,CIAT DE HONFLEUR,CIAT DE LISIEUX,CIAT D'AURILLAC,CIAT CENTRAL D'ANGOULEME,CIAT DE COGNAC,CIAT CENTRAL DE LA ROCHELLE,CIAT DE ROCHEFORT,CIAT DE ROYAN,CIAT DE SAINTES,CIAT CENTRAL DE BOURGES,CIAT DE VIERZON,CIAT DE BRIVE,CIAT DE TULLE,CIAT D'USSEL,BMRA 21,DIPJ DE DIJON,CIAT CENTRAL DE DIJON,CIAT DE BEAUNE,CIAT DE LANNION,CIAT DE ST BRIEUC,CIAT DE GUERET,ANTENNE PJ DE PERIGUEUX,CIAT DE BERGERAC,CIAT DE PERIGUEUX,BMRA 25,SPAFT PONTARLIER,UTE MONTBELIARD,CIAT CENTRAL DE BESANCON,CIAT DE PONTARLIER,CISP MONTBELIARD,ANTENNE PJ DE VALENCE,CIAT CENTRAL DE VALENCE,CIAT DE MONTELIMAR,CIAT DE ROMANS,CIAT DE VAL DE REUIL,CIAT DE VERNON,CIAT D'EVREUX,CIAT DE CHARTRES,CIAT DE DREUX,CIAT CENTRAL DE BREST,CIAT DE CONCARNEAU,CIAT DE MORLAIX,CIAT DE QUIMPER,BMRA 2A,SPAFA AJACCIO CAMPO DELL ORO,SPAFA BONIFACIO FIGARI,DRPJ D'AJACCIO,CIAT CENTRAL D'AJACCIO,BMRA 2B,SPAFA BASTIA PORETTA,SPAFA CALVI,SPAFT BASTIA,CIAT DE BASTIA,BMRA 30,CRA NIMES,SPAFT NIMES,ANTENNE PJ DE NIMES,CIAT CENTRAL DE NIMES,CIAT D'ALES,CIAT DE BAGNOLS SUR CEZE,BMRA 31,CRA TOULOUSE,DZPAF BPA TOULOUSE,SPAFA TOULOUSE BLAGNAC,SRPJ DE TOULOUSE,CIAT CENTRAL DE TOULOUSE,CIAT DE ST GAUDENS,CIAT D'AUCH,CRS AUTO AQUITAINE BORDEAUX CENON,BMRZ SUD OUEST,SPAFA BORDEAUX MERIGNAC,SRPJ DE BORDEAUX,CIAT CENTRAL DE BORDEAUX,CIAT D'ARCACHON,BMRA 34,SPAFP SETE,UJI MONTPELLIER,SRPJ DE MONTPELLIER,CIAT CENTRAL DE MONTPELLIER,CIAT D'AGDE,CIAT DE BEZIERS,CIAT DE SETE,BCFZ OUEST,BMRZ OUEST,DZPAF BPA RENNES,SPAFA SAINT MALO,USG 35,SRPJ DE RENNES,CIAT CENTRAL DE RENNES,CIAT DE FOUGERES,CIAT DE ST MALO,CIAT DE CHATEAUROUX,ANTENNE PJ DE TOURS,CIAT CENTRAL DE TOURS,CRS ALPES GRENOBLE,BMRA 38,ANTENNE PJ DE GRENOBLE,CIAT CENTRAL DE GRENOBLE,CIAT DE BOURGOIN JALLIEU,CIAT DE VIENNE,CIAT DE VOIRON,CIAT DE DOLE,CIAT DE LONS LE SAUNIER,CIAT DE DAX,CIAT DE MONT DE MARSAN,CIAT DE BLOIS,CIAT DE VENDOME,CRS AUTO R A A DETACHEMENT ST ETIENNE,ANTENNE PJ DE ST ETIENNE,CIAT CENTRAL DE ST ETIENNE,CIAT DE ROANNE,CIAT D'ONDAINE,CIAT DU GIER,CIAT DU PUY EN VELAY,BMRA 44,SPAFA NANTES ATLANTIQUE,USG 44,CIAT CENTRAL DE NANTES,CIAT DE LA BAULE,CIAT DE ST NAZAIRE,BMRA 45,SRPJ D'ORLEANS,CIAT CENTRAL D'ORLEANS,CIAT DE MONTARGIS,CIAT DE CAHORS,CIAT D'AGEN,CIAT DE VILLENEUVE SUR LOT,CIAT DE MENDE,SRPJ D'ANGERS,CIAT CENTRAL D'ANGERS,CIAT DE CHOLET,CIAT DE SAUMUR,BMRA 50,SPAFP CHERBOURG,CIAT DE CHERBOURG,CIAT DE COUTANCES,CIAT DE GRANVILLE,CIAT DE ST LO,SRPJ DE REIMS,CIAT CENTRAL DE REIMS,CIAT DE CHALONS EN CHAMPAGNE,CIAT D'EPERNAY,CIAT DE CHAUMONT,CIAT DE ST DIZIER,CIAT DE LAVAL,CRS AUTO LORRAINE ALSACE DET NANCY,BMRA 54,SPAFT MONT SAINT MARTIN,SRPJ DE NANCY,CIAT CENTRAL DE NANCY,CIAT DE BRIEY,CIAT DE CONFLANS EN JARNISY,CIAT DE DOMBASLE,CIAT DE LONGWY,CIAT DE LUNEVILLE,CIAT DE PONT A MOUSSON,CIAT DE TOUL,CIAT DE VILLERUPT,CIAT DE BAR LE DUC,CIAT DE VERDUN,CIAT DE LORIENT,CIAT DE VANNES,CRS AUTO LORRAINE ALSACE CHATELSTGERMAIN,BMRZ EST,DZPAF BPA METZ,SPAFT FORBACH,SPAFT METZ,SPAFT THIONVILLE,CIAT CENTRAL DE METZ,CIAT DE FORBACH,CIAT DE FREYMING MERLEBACH,CIAT DE SARREBOURG,CIAT DE SARREGUEMINES,CIAT DE THIONVILLE,CIAT D'HAGONDANGE,CIAT DE NEVERS,CRS AUTO NORD PDC DET ST OMER,CRS AUTO NORD PDC LILLE LAMBERSART,BCFZ NORD,BMRZ NORD,CRA LILLE,SPAFP DUNKERQUE,SPAFT LILLE,UJI VALENCIENNES,DIPJ DE LILLE,CSP DE CAMBRAI,CSP DE DOUAI AGGLOMERATION,CSP DE DUNKERQUE AGGLOMERATION,CSP DE MAUBEUGE AGGLOMERATION,CSP DE VALENCIENNES AGGLOMERATION,CSP D'HAZEBROUCK,DSP D'ARMENTIERES,DSP DE BAILLEUL,DSP DE LILLE,DSP DE ROUBAIX,DSP DE TOURCOING,BMRA 60,SPAFA BEAUVAIS TILLE,ANTENNE PJ DE CREIL,CIAT DE BEAUVAIS,CIAT DE COMPIEGNE,CIAT DE CREIL,CIAT D'ALENCON,CIAT D'ARGENTAN,CIAT DE FLERS,BMRA 62,CRA COQUELLES,SPAFP CALAIS,SPAFT COQUELLES LIEN FIXE TRANSMANCHE,USG 62,ANTENNE PJ DE COQUELLES,CIAT D'ARRAS,CIAT D'AUCHEL,CIAT D'AVION,CIAT DE BERCK,CIAT DE BETHUNE,CIAT DE BOULOGNE SUR MER,CIAT DE BRUAY LA BUISSIERE,CIAT DE CALAIS,CIAT DE LENS,CIAT DE MARLES LES MINES,CIAT DE NOEUX LES MINES,CIAT DE ST OMER,CIAT DU TOUQUET,BMRA 63,DIDPAF CLERMONT FERRAND 63,SPAFA AULNAT,SRPJ DE CLERMONT FERRAND,CIAT CENTRAL DE CLERMONT FERRAND,CIAT DE COURNON D'AUVERGNE,CIAT DE GERZAT,CIAT DE RIOM,BMRA 64,CRA HENDAYE,SPAFA BIARRITZ,SPAFT HENDAYE DANCHARIA,UJI PAU,ANTENNE PJ DE BAYONNE,ANTENNE PJ DE PAU,CIAT CENTRAL DE PAU,CIAT DE BAYONNE,CIAT DE BIARRITZ,CIAT DE ST JEAN DE LUZ,CIAT DE LOURDES,CIAT DE TARBES,BCFA PERPIGNAN,BMRA 66,CRA PERPIGNAN,SPAFT CERBERE,SPAFT LE PERTHUS,SPAFT PERPIGNAN,ANTENNE PJ DE PERPIGNAN,CIAT CENTRAL DE PERPIGNAN,CRS AUTO LORRAINE ALSACE DET STRASBOURG,BMRA 67,SPAFA STRASBOURG ENTZHEIM,SPAFT STRASBOURG,UTE LAUTERBOURG,SRPJ DE STRASBOURG,CIAT CENTRAL DE STRASBOURG,CIAT DE SELESTAT,CIAT D'HAGUENAU,BMRA 68,SPAFA BALE MULHOUSE,SPAFT ST LOUIS,CIAT CENTRAL DE MULHOUSE,CIAT DE COLMAR,CIAT DE ST LOUIS,CIAT DE WITTENHEIM,CRS AUTO RHONE ALPES AUVERGNE LYON,BCFZ SUD EST,BMRZ SUD EST,CRA LYON SAINT EXUPERY,SPAFA LYON SAINT EXUPERY,SPAFT LYON,GIR RHONE ALPES,SECTION DES ETUDES ET DE LA FORMATION,SRPJ DE LYON,CIAT DE GIVORS,CIAT DE VILLEFRANCHE SUR SAONE,DSP LYON CENTRE,DSP LYON EST,DSP LYON OUEST,LYON AGGLOMERATION,SURETE DEPARTEMENTALE DU RHONE,CIAT DE VESOUL,CS HERICOURT,CIAT DE CHALON SUR SAONE,CIAT DE MACON,CIAT DE MONTCEAU LES MINES,CIAT DU CREUSOT,CIAT CENTRAL DU MANS,BMRA 73,SPAFT CHAMBERY,SPAFT MODANE,CIAT D'AIX LES BAINS,CIAT D'ALBERTVILLE,CIAT DE CHAMBERY,BMRA 74,SPAFT CHAMONIX,SPAFT GAILLARD,ANTENNE PJ D'ANNECY,CIAT CENTRAL D'ANNECY,CIAT D'ANNEMASSE,CIAT DU LEMAN,DCPAF BCF,2EME DISTRICT,DIV PREV REPRESSION DELINQUANCE ROUTIERE,DIV REGIONALE MOTOCYCLISTE,SERVICE DE CIRCULATION DU PERIPHERIQUE,SERVICE DES COMPAGNIES MOTOCYCLISTES 75,1ER DISTRICT DE POLICE JUDICIAIRE,2EME DISTRICT DE POLICE JUDICIAIRE,3EME DISTRICT DE POLICE JUDICIAIRE,BRIGADE CRIMINELLE,BRIGADE DE LA DELINQUANCE ASTUCIEUSE,BRIGADE DE LA DELINQUANCE DE LA PERSONNE,BRIGADE DE LA DELINQUANCE ECONOMIQUE,BRIGADE DE PROTECTION DES MINEURS,BRIGADE DE REPRESSION DU BANDITISME,BRIGADE DE REPRESSION DU PROXENETISME,BRIGADE DES INVESTIGATIONS FINANCIERES,BRIGADE DES STUPEFIANTS,BRIGADE EXECUTION DECISIONS DE JUSTICE,BRIGADE FINANCIERE,BRIGADE FRAUDES AUX MOYENS DE PAIEMENT,BRIGADE FRAUDES TECHNOLOGIES DE L'INFO,BRIGADE FLUVIALE,BRF SURETE REGIONALE DES TRANSPORTS,DTSP75 01ER ARRONDISSEMENT,DTSP75 02EME ARRONDISSEMENT,DTSP75 03EME ARRONDISSEMENT,DTSP75 04EME ARRONDISSEMENT,DTSP75 05EME ET 06EME ARRONDISSEMENTS,DTSP75 06EME ARRONDISSEMENT,DTSP75 07EME ARRONDISSEMENT,DTSP75 08EME ARRONDISSEMENT,DTSP75 09EME ARRONDISSEMENT,DTSP75 10EME ARRONDISSEMENT,DTSP75 11EME ARRONDISSEMENT,DTSP75 12EME ARRONDISSEMENT,DTSP75 13EME ARRONDISSEMENT,DTSP75 14EME ARRONDISSEMENT,DTSP75 15EME ARRONDISSEMENT,DTSP75 16EME ARRONDISSEMENT,DTSP75 17EME ARRONDISSEMENT,DTSP75 18EME ARRONDISSEMENT,DTSP75 19EME ARRONDISSEMENT,DTSP75 20EME ARRONDISSEMENT,DTSP75 SURETE TERRITORIALE,SERVICE DEONTOLOGIE SYNTHESE EVALUATION,SLII DSPAP,STADE DSPAP,STJA SDPIT DSPAP,BMRA 76,CRA OISSEL,SPAFP LE HAVRE,SPAFT ROUEN,GIR HAUTE NORMANDIE,SRPJ DE ROUEN,CIAT CENTRAL DE ROUEN,CIAT DE BOLBEC,CIAT DE DIEPPE,CIAT DE FECAMP,CIAT DU HAVRE,CRS AUTO EST IDF LAGNY SUR MARNE,BMRT 77,DCPAF OCRIEST,CIAT CENTRAL DE MELUN VAL DE SEINE,CIAT DE CHELLES,CIAT DE CHESSY,CIAT DE COULOMMIERS,CIAT DE FONTAINEBLEAU,CIAT DE LAGNY,CIAT DE MEAUX,CIAT DE MOISSY CRAMAYEL,CIAT DE MONTEREAU FAULT YONNE,CIAT DE MORET SUR LOING,CIAT DE NEMOURS,CIAT DE NOISIEL,CIAT DE PONTAULT COMBAULT,CIAT DE PROVINS,CIAT DE VILLEPARISIS,SURETE DEPARTEMENTALE DE SEINE ET MARNE,BMRT 78,DCPAF EM BPA,DRPJ DE VERSAILLES,CIAT CENTRAL DE VERSAILLES,CIAT DE CONFLANS STE HONORINE,CIAT DE FONTENAY LE FLEURY,CIAT DE GUYANCOURT,CIAT DE HOUILLES CARRIERES SUR SEINE,CIAT DE LA CELLE ST CLOUD,CIAT D'ELANCOURT,CIAT DE MANTES LA JOLIE,CIAT DE MARLY LE ROI,CIAT DE PLAISIR,CIAT DE POISSY,CIAT DE RAMBOUILLET,CIAT DE SARTROUVILLE,CIAT DES MUREAUX,CIAT DE ST GERMAIN EN LAYE,CIAT DE TRAPPES,CIAT DE VELIZY VILLACOUBLAY,CIAT DU VESINET,SURETE DEPARTEMENTALE DES YVELINES,CIAT DE NIORT,CIAT DE THOUARS,ANTENNE PJ D'AMIENS,CIAT D'ABBEVILLE,CIAT D'AMIENS,CIAT D'ALBI,CIAT DE CARMAUX,CIAT DE CASTRES,CIAT DE MAZAMET,CIAT DE CASTELSARRASIN,CIAT DE MONTAUBAN,CRS AUTO PROVENCE DET TOULON OLLIOULES,BMRA 83,SPAFT TOULON,ANTENNE PJ DE TOULON,CIAT CENTRAL DE TOULON,CIAT DE DRAGUIGNAN,CIAT DE FREJUS ST RAPHAEL,CIAT DE HYERES,CIAT DE LA SEYNE,CIAT DE SANARY,BMRA 84,ANTENNE PJ D'AVIGNON,CIAT DE CARPENTRAS,CIAT DE CAVAILLON,CIAT D'ORANGE,CIRC INTERDEPARTEMENTALE D'AVIGNON,CIAT DE LA ROCHE SUR YON,CIAT DES SABLES D'OLONNE,ANTENNE PJ DE POITIERS LA ROCHELLE,CIAT CENTRAL DE POITIERS,CIAT DE CHATELLERAULT,BMRA 87,SRPJ DE LIMOGES,CIAT CENTRAL DE LIMOGES,CIAT CENTRAL D'EPINAL,CIAT DE REMIREMONT,CIAT DE ST DIE,CIAT D'AUXERRE,CIAT DE SENS,CIAT CENTRAL DE BELFORT,CRS AUTO SUD IDF MASSY,BMRT 91,CIAT D'ARPAJON,CIAT D'ATHIS MONS,CIAT DE BRUNOY,CIAT DE CORBEIL ESSONNES,CIAT DE DRAVEIL,CIAT DE JUVISY SUR ORGE,CIAT DE LONGJUMEAU,CIAT DE MASSY,CIAT DE MONTGERON,CIAT DE PALAISEAU,CIAT DE SAVIGNY SUR ORGE,CIAT DE STE GENEVIEVE DES BOIS,CIAT D'ETAMPES,CIAT D'EVRY,SURETE DEPARTEMENTALE DE L'ESSONNE,CRS AUTO OUEST IDF VAUCRESSON,BNLCOC,OCBC DCPJ5,OCLCIFF,OCLCTIC,OCRFM DCPJ10,OCRGDF DCPJ9,OCRTEH,OCRTIS,OCRVP,OFFICE CENTRAL LUTTE CRIME ORGANISE,SERVICE CENTRAL COURSES ET JEUX,SOUS DIRECTION ANTI TERRORISTE,CIE TERRITORIALE CIRCU SECU ROUT 92,GPE INTERVENTION REGIONAL 92,SDPJ DES HAUTS DE SEINE,DTSP92 ANTONY,DTSP92 ASNIERES SUR SEINE,DTSP92 BAGNEUX,DTSP92 BOULOGNE BILLANCOURT,DTSP92 CHATENAY MALABRY,DTSP92 CLAMART,DTSP92 CLICHY LA GARENNE,DTSP92 COLOMBES,DTSP92 COURBEVOIE,DTSP92 GENNEVILLIERS,DTSP92 ISSY LES MOULINEAUX,DTSP92 LA DEFENSE,DTSP92 LA GARENNE COLOMBES,DTSP92 LEVALLOIS PERRET,DTSP92 MEUDON,DTSP92 MONTROUGE,DTSP92 NANTERRE,DTSP92 NEUILLY SUR SEINE,DTSP92 PUTEAUX,DTSP92 RUEIL MALMAISON,DTSP92 SEVRES,DTSP92 ST CLOUD,DTSP92 SURESNES,DTSP92 SURETE TERRITORIALE,DTSP92 VANVES,DTSP92 VILLENEUVE LA GARENNE,SPAF LE BOURGET,CIE TERRITORIALE CIRCU SECU ROUT 93,GPE INTERVENTION REGIONAL 93,SDPJ DE SEINE ST DENIS,DTSP93 AUBERVILLIERS,DTSP93 AULNAY SOUS BOIS,DTSP93 BOBIGNY,DTSP93 BONDY,DTSP93 CLICHY MONTFERMEIL,DTSP93 DRANCY,DTSP93 EPINAY SUR SEINE,DTSP93 GAGNY,DTSP93 LA COURNEUVE,DTSP93 LE BLANC MESNIL,DTSP93 LES LILAS,DTSP93 LIVRY GARGAN,DTSP93 MONTREUIL,DTSP93 NEUILLY SUR MARNE,DTSP93 NOISY LE GRAND,DTSP93 PANTIN,DTSP93 RAINCY,DTSP93 ROSNY SOUS BOIS,DTSP93 STAINS,DTSP93 ST DENIS,DTSP93 ST OUEN,DTSP93 SURETE TERRITORIALE,DTSP93 ULII,DTSP93 VILLEPINTE,DPAF ORLY,CIE TERRITORIALE CIRCU SECU ROUT 94,GPE INTERVENTION REGIONAL 94,SDPJ DU VAL DE MARNE,DTSP94 ALFORTVILLE,DTSP94 BOISSY ST LEGER,DTSP94 CHAMPIGNY SUR MARNE,DTSP94 CHARENTON LE PONT,DTSP94 CHENNEVIERES SUR MARNE,DTSP94 CHOISY LE ROI,DTSP94 CRETEIL,DTSP94 FONTENAY SOUS BOIS,DTSP94 IVRY SUR SEINE,DTSP94 KREMLIN BICETRE,DTSP94 L'HAY LES ROSES,DTSP94 MAISONS ALFORT,DTSP94 NOGENT SUR MARNE,DTSP94 ST MAUR DES FOSSES,DTSP94 SURETE TERRITORIALE,DTSP94 VILLENEUVE ST GEORGES,DTSP94 VINCENNES,DTSP94 VITRY SUR SEINE,CRS AUTO NORD IDF DEUIL LA BARRE,BMR ROISSY,BMRT 95,ROISSY AEROPORT,CIAT D'ARGENTEUIL,CIAT DE BEZONS,CIAT DE CERGY PONTOISE,CIAT DE DEUIL LA BARRE,CIAT DE GARGES LES GONESSE,CIAT DE GONESSE,CIAT D'ENGHIEN LES BAINS,CIAT D'ERMONT,CIAT DE SARCELLES,CIAT DE TAVERNY,CIAT D'HERBLAY,SURETE DEPARTEMENTALE DU VAL D'OISE,DDPAF BMR 971,DDPAF UJI 971 GRANDE TERRE,SPAF BASSE TERRE,SPAF POINTE A PITRE,SPAF POLE CARAIBE,SPAF ST MARTIN,DIPJ DE POINTE A PITRE,GIR GUADELOUPE,CIAT DE BASSE TERRE,CIAT DE CAPESTERRE BELLE EAU,CIAT DE POINTE A PITRE,DDPAF BMR 972,SPAF FORT DE FRANCE LE LAMENTIN,ANTENNE OCRTIS CARAIBE,CIAT DE FORT DE FRANCE,CIAT DU LAMENTIN,DDPAF BMR 973,SPAF CAYENNE FELIX EBOUE ROCHAMBEAU,SPAF SAINT GEORGES DE L'OYAPOCK,SPAF ST LAURENT DU MARONI,CIAT DE CAYENNE,DDPAF BMR 974,SPAF GILLOT,SPAF PIERREFONDS,CIAT DE ST ANDRE,CIAT DE ST PIERRE,CIAT DU PORT,SURETE DEPARTEMENTALE DE LA REUNION,BMR DZAOUDZI,SPAF PAMANDZI,CIAT DE MAMOUDZOU,DPAF BMR 987,SPAF TAHITI FAAA,CIAT DE PAPEETE,DPAF BMR 988,SPAF NOUMEA LA TONTOUTA,CIAT DE NOUMEA
1,Règlements de compte entre malfaireurs,0,0,0,0,0,0,0,0,0,0,0,0,0,0,0,0,0,0,0,0,0,0,0,0,0,0,0,0,0,0,0,0,0,0,0,0,0,0,0,0,0,0,0,0,0,0,0,0,0,0,0,0,0,24,0,0,0,0,1,0,0,0,0,0,0,0,0,0,0,0,0,0,0,0,0,0,0,0,0,0,0,0,0,0,0,0,0,0,1,0,0,0,0,0,0,0,0,0,0,0,0,0,0,0,0,0,0,0,0,0,0,0,0,0,0,0,0,0,1,0,0,0,0,0,0,0,0,0,0,0,0,0,0,0,0,0,0,0,0,0,0,0,0,0,0,0,0,0,0,0,0,0,0,0,0,0,0,0,0,0,0,0,0,0,0,0,0,0,5,0,0,0,0,0,0,0,0,0,1,0,1,0,0,0,1,0,0,0,0,0,0,0,0,0,0,0,0,0,0,0,0,0,0,0,0,0,0,0,0,0,0,0,0,0,0,0,0,0,0,0,0,0,0,0,0,0,0,0,0,0,0,0,0,0,0,0,0,0,0,0,0,0,0,0,0,0,0,0,0,0,0,1,0,0,0,0,0,0,0,0,0,0,0,0,0,0,0,0,0,0,1,0,0,0,0,0,0,0,0,0,0,0,0,0,0,0,0,0,0,0,0,1,0,0,0,0,0,0,0,0,0,0,0,0,0,0,0,0,0,0,0,0,0,0,0,0,0,0,0,0,0,0,0,1,0,0,0,0,0,0,1,1,0,0,0,0,0,0,0,0,0,0,0,0,0,0,0,0,0,2,0,0,0,0,0,0,0,0,0,0,0,0,0,0,0,0,0,0,0,0,0,0,0,0,0,0,0,0,0,0,0,0,0,0,0,0,4,0,0,0,0,0,0,0,0,0,0,0,0,0,0,0,0,0,0,0,0,0,0,0,0,1,0,0,0,0,0,0,0,0,0,0,0,0,0,0,0,0,0,0,0,0,0,0,0,0,0,0,0,0,0,0,0,0,0,0,0,0,0,0,0,0,0,0,0,0,0,0,2,0,0,0,0,0,0,0,0,0,0,0,0,0,0,0,0,0,0,0,0,0,0,0,0,0,0,0,0,0,0,0,0,0,1,0,0,0,0,0,0,0,0,0,0,0,0,0,0,0,0,0,0,0,0,0,0,0,0,0,0,0,0,0,0,0,0,0,0,0,0,0,0,0,0,0,0,0,0,0,0,0,0,0,0,0,0,0,0,0,0,0,0,0,0,0,0,0,0,0,0,0,0,0,0,0,0,0,0,0,0,0,0,0,0,0,0,0,0,0,0,0,0,0,0,0,0,0,0,0,0,0,0,0,2,0,0,0,0,0,0,0,0,1,0,0,0,1,0,0,0,0,0,0,0,0,0,0,0,0,0,0,0,0,0,0,0,0,0,0,0,0,0,0,0,0,0,0,0,0,0,0,0,0,0,0,0,0,0,0,0,0,3,0,0,0,0,0,0,0,0,0,0,0,0,0,1,0,0,0,0,0,0,0,0,0,0,0,0,0,0,0,0
2,Homicides pour voler et à l'occasion de vols,0,0,0,0,0,0,0,0,0,0,0,0,0,0,0,0,0,0,0,0,0,0,0,0,0,0,0,0,0,0,0,0,0,0,0,0,0,0,0,0,0,0,0,0,0,0,0,0,0,0,0,0,0,0,0,0,0,0,0,0,0,0,0,0,0,0,0,0,0,0,0,0,0,0,0,0,0,0,0,0,0,0,0,0,0,0,0,0,0,0,0,0,0,0,0,0,0,0,0,0,0,0,0,0,0,0,0,0,0,0,0,0,0,0,0,0,0,0,0,0,0,0,0,0,0,0,0,0,0,0,0,0,0,0,0,0,0,0,0,0,0,0,0,0,0,0,0,0,0,0,0,0,0,0,0,0,0,0,0,0,0,0,0,0,0,0,0,0,0,0,0,0,0,0,0,0,0,0,0,0,0,0,0,0,0,0,0,0,0,0,0,0,0,0,0,0,0,0,0,0,0,0,0,0,0,0,0,0,0,0,0,0,0,0,0,0,0,0,0,0,0,0,0,0,0,0,0,0,0,0,0,0,0,0,0,0,0,0,0,0,0,0,0,0,0,0,0,0,0,0,0,0,0,0,0,0,0,0,0,0,0,0,0,0,0,0,0,0,0,0,0,0,0,0,0,0,0,0,0,0,0,0,0,0,0,0,0,0,0,0,0,0,0,0,0,0,0,0,0,0,0,0,0,0,0,0,0,0,0,0,0,0,0,0,0,0,0,0,0,0,0,0,0,0,0,0,0,0,0,0,0,1,0,0,0,0,0,0,0,0,0,0,0,0,0,0,0,0,0,0,0,0,0,0,0,0,0,0,0,0,0,0,0,0,0,0,0,0,0,0,0,0,0,1,0,0,0,0,0,0,0,0,0,0,0,0,3,0,0,0,0,0,0,0,0,0,0,0,0,0,0,0,0,0,0,0,0,0,0,0,0,0,0,0,0,0,0,0,0,0,0,0,0,0,0,0,0,0,0,0,0,0,0,0,0,0,0,0,0,0,0,0,0,0,0,0,0,0,0,0,0,0,0,0,0,0,0,0,0,0,0,0,0,0,0,0,0,0,0,0,0,0,0,0,0,0,0,0,0,0,0,0,0,0,0,0,0,0,0,0,0,0,0,0,0,0,0,0,0,0,0,0,0,0,0,0,0,4,0,0,0,0,0,0,0,0,0,0,0,0,0,0,0,0,0,0,0,0,0,0,0,0,0,0,0,0,0,0,0,0,0,0,0,0,0,0,0,0,0,0,0,0,0,0,0,0,0,0,0,0,0,0,0,0,0,0,0,0,0,0,0,0,0,0,0,0,0,0,0,0,0,0,0,0,0,0,0,0,0,0,0,0,0,0,0,0,0,0,0,0,0,0,0,0,0,0,0,0,0,0,0,0,0,0,0,0,1,1,0,0,0,0,0,0,0,0,0,0,0,0,0,0,0,0,0,0,0,0,0,0,0,0,0,0,0,0,0,0,0,0,7,0,0,0,2,0,0,0,0,0,0,0,0,0,1,0,0,0,0,0,0,0,0,0,1,0,0,0,0,0,0
3,Homicides pour d'autres motifs,0,0,1,0,1,0,0,1,1,0,1,0,1,0,0,0,0,0,0,0,0,0,2,1,1,1,1,0,0,1,0,0,0,0,0,0,4,0,0,0,0,0,0,0,0,0,0,0,0,0,0,0,0,7,1,0,0,0,1,0,0,0,1,0,1,0,1,7,0,2,0,0,0,0,1,2,0,1,1,0,0,0,0,1,0,0,0,0,2,0,0,0,1,0,0,0,0,0,0,1,0,0,1,0,0,1,0,0,2,0,3,0,0,0,0,0,0,0,0,1,0,0,0,0,1,0,0,0,0,3,1,0,0,0,0,0,9,7,0,1,0,0,0,5,4,0,0,0,0,0,3,1,2,0,0,0,0,0,0,4,1,0,0,0,1,0,0,0,1,1,0,0,0,0,0,0,1,1,1,0,2,5,2,1,0,0,0,0,0,6,1,1,0,1,1,0,1,2,0,0,0,1,0,0,0,0,1,0,1,1,1,2,1,0,1,0,0,0,0,0,0,3,1,0,1,0,2,0,0,0,0,0,1,0,0,0,0,0,0,0,2,1,0,1,0,0,0,0,0,0,0,0,0,0,0,0,3,1,1,3,0,4,0,0,0,4,1,0,0,0,1,1,1,0,0,0,0,0,0,0,0,0,4,0,0,0,0,0,0,0,3,5,0,0,0,0,0,0,0,1,2,0,0,0,0,0,0,0,0,0,2,3,1,1,1,0,0,0,0,0,0,0,0,0,2,0,0,0,0,0,3,2,0,0,0,0,0,2,1,0,0,0,0,0,0,0,0,0,0,6,0,0,1,0,0,10,1,0,0,0,0,0,0,2,0,0,0,1,0,0,0,0,0,1,0,0,0,0,0,0,0,0,0,6,2,2,11,0,1,0,0,0,0,0,0,0,0,0,0,0,1,0,0,1,0,1,0,1,0,0,1,0,0,5,0,2,0,0,2,1,3,0,0,0,0,0,0,0,0,0,0,8,3,0,1,0,1,0,0,0,0,0,0,1,1,0,0,0,0,0,0,0,0,1,0,0,0,0,2,0,1,0,0,0,0,0,0,0,2,0,0,0,0,3,0,0,0,0,1,0,0,0,0,0,1,0,0,1,1,0,0,0,1,4,2,4,0,1,0,0,1,0,1,0,2,1,0,3,1,0,0,0,0,0,0,0,0,1,0,0,0,0,0,0,1,1,0,0,1,0,1,1,1,0,1,2,0,0,0,0,0,0,0,0,0,1,0,0,0,0,0,1,1,0,0,0,0,0,0,0,0,0,1,0,0,0,0,0,0,0,0,0,0,0,0,0,0,0,0,0,0,1,1,1,0,0,0,0,1,0,0,3,0,0,4,1,0,3,0,0,1,4,0,0,0,0,0,0,0,4,1,0,0,0,0,0,0,0,0,0,2,0,0,0,0,0,0,0,0,0,0,0,2,0,0,0,0,2,2,0,1,0,0,0,0,0,0,0,0,0,67,0,0,0,4,0,0,0,7,3,0,0,0,0,13,0,0,0,0,2,1,2,0,0,4,0,0,0,0,0,2
4,Tentatives d'homicides pour voler et à l'occasion de vols,0,0,0,0,0,0,0,0,0,0,0,0,0,0,0,0,0,0,0,0,0,0,0,0,0,0,0,0,0,0,0,0,0,0,0,0,0,0,0,0,1,0,0,0,0,0,0,0,0,0,0,0,0,1,0,0,0,0,0,0,0,0,1,0,0,0,0,1,0,0,0,0,0,0,0,0,0,0,0,0,0,0,0,0,0,0,0,1,0,0,0,0,0,0,0,0,0,0,0,0,0,0,0,0,0,0,0,0,0,0,0,0,0,0,0,0,0,0,0,0,0,0,0,0,0,0,0,0,0,0,0,0,0,0,0,0,0,0,0,0,0,0,0,0,3,0,0,0,0,0,0,0,0,0,0,0,0,0,0,2,0,0,0,0,0,0,0,0,1,0,0,0,0,0,0,0,0,0,0,0,0,0,0,0,0,0,0,0,0,0,0,0,0,0,0,0,0,0,0,0,0,0,0,0,0,0,0,0,0,0,0,0,0,0,0,0,0,0,0,0,1,0,0,0,0,0,0,0,0,0,0,0,0,0,0,0,0,0,0,0,0,0,0,0,0,0,0,0,0,0,0,0,0,0,0,0,1,0,0,0,0,0,0,0,0,3,0,0,0,0,0,0,0,0,0,0,0,0,0,0,0,0,0,0,0,0,0,0,0,0,0,0,0,0,0,0,0,0,0,0,0,0,0,0,0,0,0,0,0,0,1,0,0,0,0,0,0,0,0,0,0,0,0,0,0,0,0,0,0,0,2,0,0,0,0,0,0,0,0,0,0,0,0,0,0,0,0,0,0,0,0,0,0,0,0,0,0,0,0,0,0,0,0,2,0,0,0,0,0,0,0,0,0,0,0,0,0,0,0,0,0,0,0,0,2,3,0,0,0,0,0,5,0,0,0,0,0,0,0,0,1,0,0,0,0,0,0,0,0,0,0,0,0,1,0,0,0,0,0,1,0,0,0,0,0,0,0,0,0,0,0,0,0,0,0,0,0,0,0,0,0,0,0,0,0,0,1,0,0,0,0,0,0,0,0,0,0,0,1,0,0,0,0,0,0,1,0,0,0,0,0,0,0,0,0,0,0,0,0,0,0,1,0,0,0,0,0,0,0,0,0,0,0,0,1,1,0,0,0,0,0,0,0,0,0,0,0,1,0,0,0,0,0,0,0,0,0,0,0,0,0,0,0,0,0,0,0,0,0,0,0,0,1,0,0,0,0,0,0,0,0,0,0,0,0,0,0,0,0,0,0,0,0,1,0,0,0,0,0,0,0,0,0,0,0,1,0,0,0,0,0,0,0,0,0,0,0,0,0,0,0,0,0,0,0,0,0,0,0,0,1,0,0,0,0,0,0,0,0,0,0,0,0,0,0,0,0,0,0,2,0,0,0,0,0,0,2,0,0,0,0,0,0,0,2,0,0,0,0,0,0,0,0,0,0,0,0,0,0,0,0,0,0,0,0,0,0,0,0,0,3,0,0,0,3,0,0,0,0,0,0,0,0,0,2,0,0,0,0,0,0,0,0,0,3,0,0,0,0,0,0
